Article ID	Pub. Year	Authors	Affiliations	Title	Recommendation 1	Recommendation 2	Recommendation 3	Recommendation 4	Recommendation 5	Recommendation 6	Recommendation 7	Recommendation 8	Recommendation 9	Recommendation 10	url
000329	2017	Marinella Testori	King's College London	Methods of quality, quality of methods. What does Roberto Busa have to communicate to digital humanists in the 21st century? From hermeneutics to performativity.	000456	000380	000065	000741	000261	000317	000095	000055	000001	000119	https://digitalhumanities.org/dhq/vol/11/3/000329/000329.html
000330	2017	Shannon Kelley	Fairfield University	Getting on the Map: A Case Study in Digital Pedagogy and Undergraduate Crowdsourcing	000302	000334	000305	000303	000572	000668	000322	000358	000647	000311	https://digitalhumanities.org/dhq/vol/11/3/000330/000330.html
000331	2017	Calvin Fung	Monash University	Playing with Identities: Queering Digital Narratology and the Exploration of Gender and Sexual Identities	000566	000639	000562	000545	000211	000432	000208	000610	000201	000641	https://digitalhumanities.org/dhq/vol/11/3/000331/000331.html
000332	2017	Wooseob Jeong	Emporia State University	Media Visualization of Book Cover Images: Exploring Differences among Bestsellers in Different Countries	000276	000500	000486	000423	000521	000406	000560	000290	000275	000019	https://digitalhumanities.org/dhq/vol/11/3/000332/000332.html
000333	2017	Kimmo Kettunen | Eetu Mäkelä | Teemu Ruokolainen | Juha Kuokkala | Laura Löfberg	National Library of Finland, Mikkeli, Finland | University of Helsinki, Helsinki Centre for Digital Humanities | National Library of Finland, Mikkeli, Finland | University of Helsinki, Department of Modern Languages, Helsinki, Finland | Department of Linguistics and English Language, Lancaster University, UK	Old Content and Modern Tools – Searching Named Entities in a Finnish OCRed Historical Newspaper Collection 1771–1910	000735	000574	000328	000544	000606	000649	000550	000298	000723	000711	https://digitalhumanities.org/dhq/vol/11/3/000333/000333.html
000334	2017	Emily Christina Murphy | Shannon R. Smith	Queen's University | Bader International Study Centre, Herstmonceux Castle, Queen's University	Introduction	000305	000315	000303	000302	000419	000311	000647	000570	000358	000443	https://digitalhumanities.org/dhq/vol/11/3/000334/000334.html
000335	2017	Simon Mahony	University College London	The Digital Classicist: building a Digital Humanities Community	000035	000294	000023	000024	000028	000316	000123	000540	000111	000034	https://digitalhumanities.org/dhq/vol/11/3/000335/000335.html
000336	2017	Anela Chan | Richard Chenhall | Tamara Kohn | Carolyn Stevens	Independent Scholar | University of Melbourne | University of Melbourne | Monash University	Interdisciplinary Collaboration and Brokerage in the Digital Humanities	000507	000339	000501	000626	000239	000433	000246	000080	000557	000281	https://digitalhumanities.org/dhq/vol/11/3/000336/000336.html
000337	2017	Florentina Armaselu | Charles van den Heuvel	University of Luxembourg | Huygens ING, The Hague, Netherlands; University of Amsterdam	Metaphors in Digital Hermeneutics: Zooming through Literary, Didactic and Historical Representations of Imaginary and Existing Cities	000472	000490	000290	000415	000088	000005	000341	000275	000328	000728	https://digitalhumanities.org/dhq/vol/11/3/000337/000337.html
000338	2018	Melvin Wevers | Jesper Verhoef	DH Group, KNAW HUC, Amsterdam, The Netherlands | TU Delft, Delft, The Netherlands	Coca-Cola: An Icon of the American Way of Life. An Iterative Text Mining Workflow for Analyzing Advertisements in Dutch Twentieth-Century Newspapers	000326	000275	000094	000260	000401	000445	000459	000263	000238	000578	https://digitalhumanities.org/dhq/vol/11/4/000338/000338.html
000339	2017	April Grow | Melanie Dickinson | Johnathan Pagnutti | Noah Wardrip-Fruin | Michael Mateas	University of California Santa Cruz | University of California Santa Cruz | University of California Santa Cruz | University of California Santa Cruz | University of California Santa Cruz	Crafting in Games	000592	000402	000310	000630	000419	000081	000084	000397	000421	000002	https://digitalhumanities.org/dhq/vol/11/4/000339/000339.html
000340	2017	Talea Anderson | David Squires	Washington State University | University of Louisiana at Lafayette	Open Access and the Theological Imagination	000463	000035	000593	000111	000596	000023	000144	000634	000690	000112	https://digitalhumanities.org/dhq/vol/11/4/000340/000340.html
000341	2018	J. Berenike Herrmann	Basel University	In a test bed with Kafka. Introducing a mixed-method approach to digital stylistics	000326	000337	000731	000547	000687	000192	000100	000371	000566	000295	https://digitalhumanities.org/dhq/vol/11/4/000341/000341.html
000342	2018	Iris Hendrickx | Louis Onrust | Florian Kunneman | Ali Hürriyetoğlu | Wessel Stoop | Antal van den Bosch	Centre for Language Studies, Radboud University, Nijmegen, The Netherlands; Centre for Language and Speech Technology, Radboud University, Nijmegen, The Netherlands | Centre for Language Studies, Radboud University, Nijmegen, The Netherlands | Centre for Language Studies, Radboud University, Nijmegen, The Netherlands | Centre for Language Studies, Radboud University, Nijmegen, The Netherlands | Centre for Language and Speech Technology, Radboud University, Nijmegen, The Netherlands | Meertens Institute, Amsterdam, The Netherlands	Unraveling reported dreams with text analytics	000043	000503	000326	000105	000093	000500	000143	000012	000209	000152	https://digitalhumanities.org/dhq/vol/11/4/000342/000342.html
000343	2018	Inger Leemans | Janneke M. van der Zwaan | Isa Maks | Erika Kuijpers | Kristine Steenbergh	Faculty of Humanities, Vrije Universiteit Amsterdam, The Netherlands | Netherlands eScience Center, Amsterdam, The Netherlands | Faculty of Humanities, Vrije Universiteit Amsterdam, The Netherlands | Faculty of Humanities, Vrije Universiteit, Amsterdam, The Netherlands | Faculty of Humanities, Vrije Universiteit, Amsterdam, The Netherlands	Mining Embodied Emotions: A Comparative Analysis of Sentiment and Emotion in Dutch Texts, 1600-1800.	000691	000326	000735	000683	000498	000612	000176	000444	000673	000496	https://digitalhumanities.org/dhq/vol/11/4/000343/000343.html
000344	2017	Isabel Pedersen | Quinn DuPont	University of Ontario Institute of Technology | University of Washington	Tracking the telepathic sublime as a phenomenon in a digital humanities archive	000634	000395	000322	000378	000391	000103	000339	000614	000603	000194	https://digitalhumanities.org/dhq/vol/11/4/000344/000344.html
000345	2018	Ernesto Priani Saiso | Elena Gonzalez-Blanco García	Universidad Nacional Autónoma de México (UNAM) | Universidad Nacional de Educación a Distancia (UNED)	Introducción de los editores	000608	000352	000353	000346	000355	000502	000347	000453	000142	000649	https://digitalhumanities.org/dhq/vol/12/1/000345/000345.html
000346	2018	José Calvo Tello | Juan Cerezo Soler	Universidad de Würzburg | Universidad Autónoma de Madrid	La conquista de Jerusalén ¿de Cervantes? Análisis estilométrico sobre autoría en el teatro del Siglo de Oro español	000353	000502	000355	000345	000347	000608	000352	000142	000649	000453	https://digitalhumanities.org/dhq/vol/12/1/000346/000346.html
000347	2018	Paulo Antonio Gatica Cote	Universidad de Salamanca	Cartografías de la sociedad red	000353	000352	000608	000502	000355	000346	000345	000142	000649	000458	https://digitalhumanities.org/dhq/vol/12/1/000347/000347.html
000348	2018	Anne Baillot	Le Mans Université	Reconstruire ce qui manque – ou le déconstruire ? Approches numériques des sources historiques	000363	000365	000359	000364	000362	000349	000354	000367	000357	000366	https://digitalhumanities.org/dhq/vol/12/1/000348/000348.html
000349	2018	Marine Riguet | Motasem Alrahabi	Labex OBVIL (Paris-Sorbonne) | Paris-Sorbonne Abou Dhabi	Pour une analyse automatique du jugement critique : les citations modalisées dans le discours littéraire du XIXe siècle	000363	000348	000357	000365	000364	000362	000359	000354	000367	000366	https://digitalhumanities.org/dhq/vol/12/1/000349/000349.html
000350	2018	Bridget Almas | Thibault Clérice	The Alpheios Project, Ltd. | Centre Jean-Mabillon (École des chartes) - PSL	Continuous Integration and Unit Testing of Digital Editions	000035	000561	000181	000245	000028	000023	000255	000024	000293	000563	https://digitalhumanities.org/dhq/vol/11/4/000350/000350.html
000351	2018	Gabriele Griffin | Matt Steven Hayler	Uppsala University | Birmingham University, UK	Collaboration in Digital Humanities Research – Persisting Silences	000477	000464	000302	000411	000465	000322	000701	000123	000616	000112	https://digitalhumanities.org/dhq/vol/12/1/000351/000351.html
000352	2018	Paola Ricaurte Quijano	Tecnológico de Monterrey	Laboratorios ciudadanos y humanidades digitales	000608	000346	000353	000355	000502	000347	000345	000142	000649	000453	https://digitalhumanities.org/dhq/vol/12/1/000352/000352.html
000353	2018	Cecily Raynor	McGill University	Geografías digitales: Iluminando las relaciones espaciales en una colección de blogs literarios	000608	000355	000347	000502	000352	000346	000345	000142	000649	000458	https://digitalhumanities.org/dhq/vol/12/1/000353/000353.html
000354	2018	Camille Monnier	French Ministry of Culture	Élaboration d’un modèle appuyé sur le modèle RDF dans le cadre de la réalisation d’une Bibliothèque virtuelle Chris Marker à la Cinémathèque française	000365	000363	000362	000364	000359	000366	000367	000357	000348	000349	https://digitalhumanities.org/dhq/vol/12/1/000354/000354.html
000355	2018	Suzana Sukovic | Peter Read	HETI (Health Education and Training Institute) | Australian National University	Retorno a trazos de mil historias	000353	000608	000502	000346	000352	000347	000345	000142	000649	000453	https://digitalhumanities.org/dhq/vol/12/1/000355/000355.html
000356	2018	Jim McGrath	Brown University	Reappearing Acts: A Review of Lori Emerson’s Reading Writing Interfaces: From the Digital to the Bookbound	000238	000139	000046	000111	000314	000533	000151	000700	000113	000086	https://digitalhumanities.org/dhq/vol/11/3/000356/000356.html
000357	2018	Élodie Bénard | Francesca Frontini	Université Paris-Sorbonne | Université Paul Valéry Montpellier	Les Sganarelle de Molière : un nom, des syntaxes ?	000349	000363	000354	000348	000365	000362	000364	000367	000359	000366	https://digitalhumanities.org/dhq/vol/12/1/000357/000357.html
000358	2018	Daniel G. Tracy | Elizabeth Massa Hoiem	University of Illinois at Urbana-Champaign | University of Illinois at Urbana-Champaign	Scaffolding and Play Approaches to Digital Humanities Pedagogy: Assessment and Iteration in Topically-Driven Courses	000443	000311	000552	000420	000743	000157	000248	000434	000239	000441	https://digitalhumanities.org/dhq/vol/11/4/000358/000358.html
000359	2018	Christelle Cocco | Grégory Dessart | Olga Serbaeva | Pierre-Yves Brandt | Dominique Vinck | Frédéric Darbellay	Université de Lausanne | Université de Lausanne | Universités de Lausanne et de Zürich | Université de Lausanne | Université de Lausanne | Université de Genève	Potentialités et difficultés d’un projet en humanités numériques (DH) : confrontation aux outils et réorientations de recherche	000365	000363	000364	000367	000362	000354	000348	000366	000349	000357	https://digitalhumanities.org/dhq/vol/12/1/000359/000359.html
000360	2018	Jamie Peter Redgate	University of Glasgow	How to Read Minds: A Review of Refiguring Minds in Narrative Media by David Ciccoricco (Lincoln: University of Nebraska Press, 2015)	000331	000066	000002	000486	000098	000165	000101	000129	000433	000478	https://digitalhumanities.org/dhq/vol/11/2/000360/000360.html
000361	2018	Madison Percy Jones	University of Florida	Environing Media: A Review of Nicole Starosielski’s The Undersea Network	000626	000294	000482	000090	000415	000667	000736	000490	000629	000631	https://digitalhumanities.org/dhq/vol/11/4/000361/000361.html
000362	2018	Jean Guy Meunier	Université du Québec à Montréal	Le texte numérique : enjeux herméneutiques	000363	000364	000348	000349	000357	000366	000365	000354	000367	000359	https://digitalhumanities.org/dhq/vol/12/1/000362/000362.html
000363	2018	Ioana Galleron | Fatiha Idmhand | Cécile Meynard	University of Grenoble | Université de Poitiers | University of Angers	Que mille lectures s’épanouissent… Modélisation du personnage et expérience de crowdreading	000357	000349	000364	000362	000365	000348	000354	000359	000367	000366	https://digitalhumanities.org/dhq/vol/12/1/000363/000363.html
000364	2018	Caroline Ardrey | Mylène Dubiau | Helen Abbott	The University of Birmingham | Université de Toulouse — Jean Jaurès | The University of Birmingham	Entre musique et lettres : vers une méthodologie numérique pour l’analyse de la mise en musique des poésies de Charles Baudelaire	000365	000362	000363	000366	000354	000359	000348	000357	000367	000349	https://digitalhumanities.org/dhq/vol/12/1/000364/000364.html
000365	2018	Marc Renneville | Jean-Lucien Sanchez | Sophie Victorien	CLAMOR. Center for Digital Humanities and History of Justice (CNRS) | CLAMOR. Center for Digital Humanities and History of Justice (CNRS) | CLAMOR. Center for Digital Humanities and History of Justice (CNRS)	Criminocorpus. Un projet numérique pour l'histoire de la justice	000364	000359	000354	000363	000367	000348	000366	000362	000349	000357	https://digitalhumanities.org/dhq/vol/12/1/000365/000365.html
000366	2018	Aurélien Berra | Claire Clivaz | Sophie Marcotte | Emmanuelle Morlock	Université Paris-Nanterre | Institut Suisse de Bioinformatique | Concordia University | Centre national de la recherche scientifique	Introduction	000365	000364	000363	000362	000354	000348	000359	000367	000349	000357	https://digitalhumanities.org/dhq/vol/12/1/000366/000366.html
000367	2018	Marie Delcourte-Debarre	Université de Valenciennes et du Hainaut-Cambrésis	Analyser les emboîtements d’échelles spatio-temporelles d’un territoire forestier : du système d’information géographique à la méthode SyMoGIH (Avesnois, France)	000365	000359	000363	000354	000348	000364	000362	000357	000349	000366	https://digitalhumanities.org/dhq/vol/12/1/000367/000367.html
000368	2018	Laura F. Hawkins	Harvard University	Computational Models for Analyzing Data Collected from Reconstructed Cuneiform Syllabaries	000069	000733	000188	000699	000371	000237	000025	000146	000281	000675	https://digitalhumanities.org/dhq/vol/12/1/000368/000368.html
000369	2018	Joseph Lloyd Donica	Bronx Community College, City University of New York	Thinking Digitally: A Review of N. Katherine Hayles’s How We Think: Digital Media and Contemporary Technogenesis (University of Chicago Press, 2012)	000102	000105	000360	000394	000128	000046	000351	000080	000087	000151	https://digitalhumanities.org/dhq/vol/12/1/000369/000369.html
000370	2018	Marcia Lei Zeng | Sophy Shu-Jiun Chen	Kent State University, Kent, Ohio, USA | Academia Sinica, Taiwan	Knowledge Organization and Cultural Heritage in the Semantic Web – A Review of a Conference and a Special Journal Issue of JLIS	000328	000549	000524	000475	000568	000620	000605	000726	000318	000515	https://digitalhumanities.org/dhq/vol/12/1/000370/000370.html
000371	2018	Richard Forsyth | David Holmes	Independent Researcher | Department of Statistics, George Mason University	The Writeprints of Man: a Stylometric Study of Lafayette's Hand in Paine's 'Rights of Man'	000606	000723	000683	000615	000539	000341	000328	000668	000333	000579	https://digitalhumanities.org/dhq/vol/12/1/000371/000371.html
000372	2018	Michael Fox | Joseph Fletcher	University of North Carolina-Chapel Hill | University of North Carolina-Chapel Hill	"All Relate to Art": The William Blake Archive and Its Web of Relations	000174	000052	000324	000051	000054	000376	000552	000569	000155	000175	https://digitalhumanities.org/dhq/vol/12/1/000372/000372.html
000373	2018	Pelle Snickars | Roger Mähler	Umeå University | Umeå University	SpotiBot — Turing Testing Spotify	000692	000126	000522	000491	000520	000519	000533	000516	000504	000521	https://digitalhumanities.org/dhq/vol/12/1/000373/000373.html
000374	2018	Bridget Almas | Emad Khazraee | Matthew Thomas Miller | Joshua Westgard	The Alpheios Project, Ltd. | School of Information, Kent State University | Roshan Institute for Persian Studies, University of Maryland College Park | University Libraries, University of Maryland College Park	Manuscript Study in Digital Spaces: The State of the Field and New Ways Forward	000509	000593	000477	000524	000424	000589	000536	000715	000512	000586	https://digitalhumanities.org/dhq/vol/12/2/000374/000374.html
000375	2019	Jasmijn Van Gorp | Marc Bron	Utrecht University | Schibsted	Building Bridges: Collaboration between Computer Sciences and Media Studies in a Television Archive Project	000472	000478	000741	000497	000620	000688	000111	000621	000698	000401	https://digitalhumanities.org/dhq/vol/13/3/000375/000375.html
000376	2018	Joel Schneier | Timothy Stinson | Matthew Davis	North Carolina State University | North Carolina State University | McMaster University	BigDIVA and Networked Browsing: A Case for Generous Interfacing and Joyous Searching	000327	000205	000265	000143	000379	000290	000414	000111	000501	000184	https://digitalhumanities.org/dhq/vol/12/2/000376/000376.html
000377	2018	Tobias Blanke	King's College London, Department of Digital Humanities	Predicting the Past	000223	000146	000461	000042	000069	000041	000685	000684	000043	000681	https://digitalhumanities.org/dhq/vol/12/2/000377/000377.html
000378	2018	Michael Marcinkowski	Bath Spa University	Methodological Nearness and the Question of Computational Literature	000087	000616	000314	000154	000599	000389	000102	000139	000155	000152	https://digitalhumanities.org/dhq/vol/12/2/000378/000378.html
000379	2018	Deena Engel | Lauren Hinkson | Joanna Phillips | Marion Thain	New York University | Solomon R. Guggenheim Museum | Solomon R. Guggenheim Museum | New York University	Reconstructing Brandon (1998-1999): A Cross-disciplinary Digital Humanities Study of Shu Lea Cheang’s Early Web Artwork	000554	000334	000516	000501	000239	000310	000413	000419	000610	000454	https://digitalhumanities.org/dhq/vol/12/2/000379/000379.html
000380	2018	Steven Jones	University of South Florida	Reverse Engineering the First Humanities Computing Center	000456	000741	000468	000201	000008	000140	000065	000329	000119	000479	https://digitalhumanities.org/dhq/vol/12/2/000380/000380.html
000381	2019	Timothy C. Duguid | Maristella Feustle | Francesca Giannetti | Elizabeth Grumbach	University of Glasgow | University of North Texas | Rutgers University | Arizona State University	Music Scholarship Online (MuSO): A Research Environment for a More Democratic Digital Musicology	000678	000254	000494	000376	000600	000455	000667	000220	000031	000603	https://digitalhumanities.org/dhq/vol/13/1/000381/000381.html
000382	2018	Alex Mueller	University of Massachusetts Boston	Stealing a Corpus: Appropriating Aesop’s Body in the Early Age of Print	000718	000011	000063	000124	000268	000257	000516	000599	000180	000138	https://digitalhumanities.org/dhq/vol/12/2/000382/000382.html
000383	2018	Philip I. Buckland | Nicolò Dell'Unto | Gísli Pálsson	Umeå University, Sweden | Lund University, Sweden | Umeå University, Sweden	To tree, or not to tree? On the Empirical Basis for Having Past Landscapes to Experience.	000714	000294	000477	000396	000415	000246	000252	000384	000385	000262	https://digitalhumanities.org/dhq/vol/12/3/000383/000383.html
000384	2018	Claudia Sciuto	Umeå University	Recording invisible proofs to compose stone narratives. Applications of Near Infrared Spectroscopy in provenance studies.	000396	000388	000256	000490	000505	000236	000080	000568	000321	000245	https://digitalhumanities.org/dhq/vol/12/3/000384/000384.html
000385	2018	Eleni Bozia	University of Florida	Reviving Classical Drama: virtual reality and experiential learning in a traditional classroom	000396	000103	000248	000395	000118	000161	000080	000321	000122	000246	https://digitalhumanities.org/dhq/vol/12/3/000385/000385.html
000386	2018	Marina Hassapopoulou	New York University	From Distracted to Distributed Attention: Expanded Learning through Social Media, Augmented Reality, Remixing, and Activist Geocaching	000619	000505	000541	000712	000398	000557	000011	000521	000524	000592	https://digitalhumanities.org/dhq/vol/12/2/000386/000386.html
000387	2018	Sarah E. Kersh | Chelsea Skalak	Dickinson College | Dickinson College	From Distracted to Recursive Reading: Facilitating Knowledge Transfer through Annotation Software	000314	000643	000046	000113	000196	000507	000634	000118	000259	000569	https://digitalhumanities.org/dhq/vol/12/2/000387/000387.html
000388	2018	Jennifer Edmond	Trinity College Dublin	How Scholars Read Now: When the Signal Is the Noise	000477	000607	000389	000393	000110	000386	000351	000180	000205	000112	https://digitalhumanities.org/dhq/vol/12/2/000388/000388.html
000389	2018	Tully Barnett	Flinders University	Distributed reading: Literary reading in diverse environments	000080	000463	000484	000315	000205	000503	000378	000616	000154	000180	https://digitalhumanities.org/dhq/vol/12/2/000389/000389.html
000390	2018	Martha Hollander	Hofstra University	The Imaginary Museum: Teaching Art History with Mobile Digital Technology	000560	000663	000122	000596	000161	000540	000494	000316	000379	000049	https://digitalhumanities.org/dhq/vol/12/2/000390/000390.html
000391	2018	Grant Wythoff	Pennsylvania State University	Laptop Policy: Notes on Boredom	000276	000049	000390	000110	000393	000386	000180	000139	000387	000280	https://digitalhumanities.org/dhq/vol/12/2/000391/000391.html
000392	2018	Richard Gartner	Warburg Institute, London, UK	Using structured text corpora in Parliamentary Metadata Language for the analysis of legislative proceedings	000176	000736	000720	000708	000481	000658	000598	000697	000582	000270	https://digitalhumanities.org/dhq/vol/12/2/000392/000392.html
000393	2018	Marion Thain	King's College London	Distracted Reading: Acts of Attention in the Age of the Internet	000394	000685	000143	000389	000391	000388	000139	000110	000180	000238	https://digitalhumanities.org/dhq/vol/12/2/000393/000393.html
000394	2018	Paul Fyfe	North Carolina State University	Reading, Making, and Metacognition: Teaching Digital Humanities for Transfer	000310	000570	000322	000303	000305	000358	000302	000311	000199	000567	https://digitalhumanities.org/dhq/vol/12/2/000394/000394.html
000395	2018	Helen Slaney | Anna Foka | Sophie Bocksberger	University of Roehampton | DH Uppsala and Humlab Umeå | University of Oxford	Ghosts in the Machine: a motion-capture experiment in distributed reception	000385	000514	000396	000161	000521	000246	000511	000506	000076	000625	https://digitalhumanities.org/dhq/vol/12/3/000395/000395.html
000396	2018	Anna Foka | Jonathan Westin | Adam Chapman	Umeå University | University of Gothenburg | University of Gothenburg	Introduction to the DHQ Special Issue: Digital Technology in the Study of the Past	000246	000385	000395	000384	000161	000415	000477	000505	000383	000118	https://digitalhumanities.org/dhq/vol/12/3/000396/000396.html
000397	2018	Chris Mustazza	University of Pennsylvania	Machine-aided close listening: Prosthetic synaesthesia and the 3D phonotext	000688	000254	000146	000505	000507	000599	000519	000675	000687	000434	https://digitalhumanities.org/dhq/vol/12/3/000397/000397.html
000398	2018	Joshua L. Mann	Expositus	How Technology Means: Texts, History, and Their Associated Technologies	000505	000181	000137	000069	000247	000010	000541	000694	000183	000651	https://digitalhumanities.org/dhq/vol/12/3/000398/000398.html
000399	2018	Smiljana Antonijevic | Ellysa Stern Cahoy	The Pennsylvania State University | The Pennsylvania State University	Researcher as Bricoleur: Contextualizing humanists’ digital workflows	000477	000111	000597	000401	000589	000593	000468	000136	000374	000501	https://digitalhumanities.org/dhq/vol/12/3/000399/000399.html
000400	2018	Deanna Shemek | Antonella Guidazzoli | Maria Chiara Liguori | Giovanni Bellavia | Daniele De Luca | Luigi Verri | Silvano Imboden	University of California, Irvine, USA | VisitLab - Cineca Interuniversity Consortium, Italy | VisitLab - Cineca Interuniversity Consortium, Italy | VisitLab - Cineca Interuniversity Consortium, Italy | VisitLab - Cineca Interuniversity Consortium, Italy | VisitLab - Cineca Interuniversity Consortium, Italy | VisitLab - Cineca Interuniversity Consortium, Italy	Renaissance Remix. Isabella d’Este: Virtual Studiolo	000122	000142	000145	000268	000649	000395	000415	000385	000090	000478	https://digitalhumanities.org/dhq/vol/12/4/000400/000400.html
000401	2018	Ingrida Kelpšienė	Vilnius University, Lithuania	Defining scholarly practices, methods and tools in the Lithuanian digital humanities research community	000477	000484	000114	000111	000375	000607	000163	000466	000055	000501	https://digitalhumanities.org/dhq/vol/12/4/000401/000401.html
000402	2019	Steven Braun	Northeastern University Library, Digital Scholarship Group	Critically engaging with data visualization through an information literacy framework	000547	000556	000290	000419	000091	000513	000406	000258	000463	000257	https://digitalhumanities.org/dhq/vol/12/4/000402/000402.html
000403	2019	Catherine D'Ignazio | Rahul Bhargava	Emerson College | Massachusetts Institute of Technology	Creative Data Literacy: A Constructionist Approach to Teaching Information Visualization	000443	000394	000570	000305	000302	000116	000614	000306	000377	000304	https://digitalhumanities.org/dhq/vol/12/4/000403/000403.html
