Article ID	Pub. Year	Authors	Affiliations	Title	Recommendation 1	Recommendation 2	Recommendation 3	Recommendation 4	Recommendation 5	Recommendation 6	Recommendation 7	Recommendation 8	Recommendation 9	Recommendation 10	url
000541	2021	Taylor Arnold | Stefania Scagliola | Lauren Tilton | Jasmijn Van Gorp	University of Richmond | Université du Luxembourg | University of Richmond | Utrecht University	Introduction: Special Issue on AudioVisual Data in DH	000542	000519	000254	000586	000524	000515	000505	000506	000401	000620	https://digitalhumanities.org/dhq/vol/15/1/000541/000541.html
000542	2021	Stefania Scagliola	Université du Luxembourg	Founding the Special Interest Group Audio-Visual in Digital Humanities: An Interview with Franciska de Jong, Martijn Kleppe, and Max Kemman	000541	000687	000643	000664	000460	000341	000524	000652	000438	000458	https://digitalhumanities.org/dhq/vol/15/1/000542/000542.html
000543	2021	Tracey El Hajj	University of Victoria	Book Review: Digital Sound Studies (2018)	000626	000557	000192	000516	000507	000610	000513	000239	000600	000186	https://digitalhumanities.org/dhq/vol/15/1/000543/000543.html
000544	2021	Davor Lauc | Darko Vitek	Chair of Logic, Department of Philosophy, Faculty of Humanities and Social Sciences, University of Zagreb | Department of History, Centre of Croatian Studies, University of Zagreb	Inferring standard name form, gender and nobility from historical texts using stable model semantics	000574	000627	000328	000553	000333	000735	000623	000577	000711	000255	https://digitalhumanities.org/dhq/vol/15/1/000544/000544.html
000545	2021	Edward Larkey	University of Maryland, Baltimore County	German Narratives in International Television Format Adaptations: Comparing Du und Ich (ZDF 2002) with Un Gars, Une Fille (Quebec 1997-2002)	000043	000623	000728	000096	000640	000113	000530	000572	000092	000595	https://digitalhumanities.org/dhq/vol/15/1/000545/000545.html
000546	2021	Giulia Freni	Classics Department, University of Siena	The First Steps of Digital Humanities: A Review of Tara L. Andrews and Caroline Macé’s Analysis of Ancient and Medieval Texts and Manuscripts: Digital Approaches	000738	000197	000553	000029	000069	000382	000247	000430	000442	000024	https://digitalhumanities.org/dhq/vol/15/3/000546/000546.html
000547	2021	Rabea Kleymann | Jan-Erik Stange	Leibniz Center for Literary and Cultural Research | Freie Universität Berlin	Towards Hermeneutic Visualization in Digital Literary Studies	000341	000337	000329	000172	000616	000414	000703	000018	000472	000154	https://digitalhumanities.org/dhq/vol/15/2/000547/000547.html
000548	2021	Johannes Burgers	Ashoka University	Imagining the Continuously Present Past: Visualizing William Faulkner’s Narratives and Digital Yoknapatawpha	000414	000691	000262	000331	000162	000726	000582	000080	000224	000533	https://digitalhumanities.org/dhq/vol/15/2/000548/000548.html
000549	2021	Silvia Piccini | Andrea Bellandi | Emiliano Giovannetti	Institute for Computational Linguistics | Institute for Computational Linguistics | Institute for Computational Linguistics	A Model for Representing Diachronic Terminologies: the Saussure Case Study	000328	000568	000196	000538	000745	000605	000475	000316	000731	000068	https://digitalhumanities.org/dhq/vol/15/3/000549/000549.html
000550	2022	Jaap Verheul | Hannu Salmi | Martin Riedl | Asko Nivala | Lorella Viola | Jana Keck | Emily Bell	Utrecht University | University of Turku | University of Stuttgart | University of Turku | University of Luxembourg | German Historical Institute Washington | University of Leeds	Using word vector models to trace conceptual change over time and space in historical newspapers, 1840–1914	000333	000735	000571	000263	000687	000595	000606	000464	000463	000689	https://digitalhumanities.org/dhq/vol/16/2/000550/000550.html
000551	2021	Marco Büchler	Institut für Angewandte Informatik (InfAI)	Introduction to Göttingen Dialogues 2016	000438	000046	000016	000695	000707	000330	000010	000095	000607	000597	https://digitalhumanities.org/dhq/vol/15/1/000551/000551.html
000552	2021	Mary Mcaleer Balkun | Diana Hope Polley	Seton Hall University | United States Air Force Academy	Going Digital: Teaching Crevecoeur in the Twenty-First Century	000443	000248	000358	000169	000315	000455	000029	000600	000438	000524	https://digitalhumanities.org/dhq/vol/15/2/000552/000552.html
000553	2021	David Lassner | Anne Baillot | Sergej Dogadov | Klaus-Robert Müller | Shinichi Nakajima	Machine Learning Group, Technische Universität Berlin | Le Mans Université | Machine Learning Group, Technische Universität Berlin | Machine Learning Group, Technische Universität Berlin; Berlin Big Data Center; Germany Department of Brain and Cognitive Engineering, Korea University; Max-Planck-Institut für Informatik; Germany Berliner Zentrum für Maschinelles Lernen | Machine Learning Group, Technische Universität Berlin; Germany Berlin Big Data Center; RIKEN Center for AIP	Automatic Identification of Types of Alterations in Historical Manuscripts	000709	000069	000574	000455	000224	000620	000539	000598	000294	000560	https://digitalhumanities.org/dhq/vol/15/2/000553/000553.html
000554	2021	Christian Howard-Sukhil | Samantha Wallace | Ankita Chakrabarti	University of California, Berkeley | University of Virginia | University of Virginia	Developing Research through Podcasts: Circulating Spaces, A Case Study	000639	000519	000541	000641	000630	000527	000610	000466	000688	000667	https://digitalhumanities.org/dhq/vol/15/3/000554/000554.html
000555	2020	James Dobson	Dartmouth College	Interpretable Outputs: Criteria for Machine Learning in the Humanities	000043	000687	000291	000371	000709	000342	000720	000574	000044	000434	https://digitalhumanities.org/dhq/vol/15/2/000555/000555.html
000556	2021	Matthew Lavin	Data Analytics Program, Denison University	Why Digital Humanists Should Emphasize Situated Data over Capta	000402	000257	000091	000547	000258	000321	000290	000513	000419	000507	https://digitalhumanities.org/dhq/vol/15/2/000556/000556.html
000557	2021	Hanna Musiol	Norwegian University of Science and Technology	Beyond the Word: Immersion, Art, and Theory in Environmental and Digital Humanities Prototyping	000080	000192	000090	000246	000180	000465	000103	000466	000122	000248	https://digitalhumanities.org/dhq/vol/15/2/000557/000557.html
000558	2021	Aditi Nafde | Matt Coneys Wainwright | Kate Court | Fiona Galston | James Cummings | Tiago Sousa Garcia	Newcastle University | Newcastle University | Newcastle University | Newcastle University | Newcastle University | Newcastle University	Hands-On Reading: An Experiment in Slow Digital Reading	000426	000111	000281	000619	000082	000398	000267	000394	000443	000103	https://digitalhumanities.org/dhq/vol/15/2/000558/000558.html
000559	2021	Dena Shamsizadeh Hayatdavoodi | Niloofar Razavi | Mehrdad Qayyoomi Bidhendi	Shahid Beheshti University | Faculty of Architecture & Urban Planning, Shahid Beheshti University | Faculty of Architecture & Urban Planning, Shahid Beheshti University	Probing Through Iranian Architectural History Within the Framework of an Ontology Development Process	000119	000678	000140	000196	000129	000500	000652	000290	000471	000201	https://digitalhumanities.org/dhq/vol/15/3/000559/000559.html
000560	2021	Sabine Lang | Björn Ommer	Interdisciplinary Center for Scientific Computing, Heidelberg Collaboratory for Image Processing, Heidelberg University | Interdisciplinary Center for Scientific Computing, Heidelberg Collaboratory for Image Processing, Heidelberg University	Transforming Information Into Knowledge: How Computational Methods Reshape Art History	000540	000686	000290	000663	000423	000717	000494	000390	000517	000654	https://digitalhumanities.org/dhq/vol/15/3/000560/000560.html
000561	2021	Roman Bleier	Centre for Information Modelling, University of Graz	How to cite this digital edition?	000455	000035	000668	000245	000028	000374	000181	000293	000593	000350	https://digitalhumanities.org/dhq/vol/15/3/000561/000561.html
000562	2022	Erik Simpson | Hannah L.P. Brown | Lana Sabb | Olly Shortell | James Lee	Grinnell College | Department of Psychology, University of Florida | Grinnell College | Prescott College | University of Cincinnati	Networked Cross-Dressing: A Digital Refashioning of Shakespearean Gender Subversion	000289	000300	000566	000222	000728	000499	000148	000504	000121	000478	https://digitalhumanities.org/dhq/vol/16/3/000562/000562.html
000563	2021	Chiara Palladino | Maryam Foradi | Tariq Yousef	Classics, Furman University | University of Leipzig | Institute of Computer Science, University of Leipzig	Translation Alignment for Historical Language Learning: a Case Study	000023	000035	000034	000245	000251	000033	000181	000737	000683	000675	https://digitalhumanities.org/dhq/vol/15/3/000563/000563.html
000564	2023	Ali M. Rahman	UC Santa Barbara	A Review of Oral Tradition and the Internet: Pathways of the Mind by John Miles Foley	000122	000183	000528	000103	000628	000680	000152	000541	000556	000035	https://digitalhumanities.org/dhq/vol/17/4/000564/000564.html
000565	2021	Ryan Cordell	University of Illinois Urbana-Champaign	Review: Katherine Bode's A World of Fiction	000189	000556	000566	000555	000389	000179	000568	000545	000616	000172	https://digitalhumanities.org/dhq/vol/15/3/000565/000565.html
000566	2021	Sean Weidman | Aaren Pastor	Pennsylvania State University | Pennsylvania State University	Modernism and Gender at the Limits of Stylometry	000341	000718	000094	000428	000099	000207	000092	000539	000097	000286	https://digitalhumanities.org/dhq/vol/15/4/000566/000566.html
000567	2021	Clayton McCarl	University of North Florida	An Approach to Designing Project-Based Digital Humanities Internships	000319	000198	000302	000473	000419	000677	000322	000466	000252	000306	https://digitalhumanities.org/dhq/vol/15/3/000567/000567.html
000568	2021	Bernadette Biedermann	University of Graz	Virtual museums as an extended museum experience: Challenges and impacts for museology, digital humanities, museums and visitors – in times of (Coronavirus) crisis	000605	000316	000026	000731	000726	000196	000745	000449	000318	000328	https://digitalhumanities.org/dhq/vol/15/3/000568/000568.html
000569	2021	José Raposo | António Rito Silva | Manuel Portela	University of Lisbon, INESC-ID, IST | University of Lisbon, INESC-ID, IST | University of Coimbra, CLP-Centre for Portuguese Literature	LdoD Visual - A Visual Reader for Fernando Pessoa’s Book of Disquiet: An In-Out-In Metaphor	000599	000117	000024	000211	000082	000426	000181	000034	000561	000495	https://digitalhumanities.org/dhq/vol/15/3/000569/000569.html
000570	2021	Francesca Benatti | Paul Gooding | Matthew Sillence	The Open University | University of Glasgow | University of East Anglia	Learning Digital Humanities in a Community of Practice: the DEAR model of Postgraduate Research Training	000471	000114	000472	000628	000080	000721	000411	000607	000401	000071	https://digitalhumanities.org/dhq/vol/15/3/000570/000570.html
000571	2021	Doran Larson	Hamilton College	Prison Writer as Witness: Can DH Read for Social Justice?	000707	000462	000043	000379	000100	000634	000371	000268	000340	000124	https://digitalhumanities.org/dhq/vol/15/3/000571/000571.html
000572	2021	Jason Boyd	Ryerson University	Digital Stages for Old Plays: A Review of Shakespeare’s Language in Digital Media: Old Words, New Tools	000709	000382	000313	000183	000282	000595	000069	000320	000202	000302	https://digitalhumanities.org/dhq/vol/15/3/000572/000572.html
000573	2024	Andrew A. Cashner	University of Rochester	Lilypond Music-Notation Software in the Digital-Humanities Toolbox	000696	000525	000695	000089	000308	000142	000412	000699	000401	000451	https://digitalhumanities.org/dhq/vol/18/2/000573/000573.html
000574	2021	Pierre Chastang | Sergio Torres Aguilar | Xavier Tannier	UVSQ-Université Paris-Saclay | UVSQ-Université Paris-Saclay | Sorbonne Université	A Named Entity Recognition Model for Medieval Latin Charters	000333	000723	000544	000735	000244	000649	000461	000328	000623	000035	https://digitalhumanities.org/dhq/vol/15/4/000574/000574.html
000575	2021	Tracy L. Barnett	University of Georgia	The Age Old Question: A Review of What is Digital History? by Hannu Salmi	000472	000485	000172	000285	000528	000653	000303	000003	000222	000116	https://digitalhumanities.org/dhq/vol/15/4/000575/000575.html
000577	2022	Suphan Kirmizialtin | David Joseph Wrisley	NYU Abu Dhabi | NYU Abu Dhabi	Automated Transcription of Non-Latin Script Periodicals: A Case Study in the Ottoman Turkish Print Archive	000593	000564	000110	000471	000112	000125	000589	000424	000412	000035	https://digitalhumanities.org/dhq/vol/16/2/000577/000577.html
000578	2021	Benjamin Lee	The Library of Congress & The University of Washington	Compounded Mediation: A Data Archaeology of the Newspaper Navigator Dataset	000609	000640	000064	000192	000296	000644	000174	000145	000208	000600	https://digitalhumanities.org/dhq/vol/15/4/000578/000578.html
000579	2021	Erik Ketzan | Christof Schöch	Trinity College Dublin | University of Trier	Classifying and Contextualizing Edits in Variants with Coleto: Three Versions of Andy Weir’s The Martian	000615	000455	000144	000552	000705	000489	000515	000081	000583	000682	https://digitalhumanities.org/dhq/vol/15/4/000579/000579.html
000581	2021	Nouf Alrasheed | Praveen Rao | Viviana Grieco	Department of Computer Science. & Electrical Engineering. University of Missouri-Kansas City | Department of Health Management & Informatics, Department of Electrical Engineering & Computer Science. University of Missouri-Columbia | Department of History. University of Missouri-Kansas City	Character Recognition Of Seventeenth-Century Spanish American Notary Records Using Deep Learning	000682	000577	000738	000491	000412	000735	000733	000268	000322	000523	https://digitalhumanities.org/dhq/vol/15/4/000581/000581.html
000582	2022	Blanca Calvo Figueras | Tommaso Caselli | Marcel Broersma	University of Gronigen | University of Groningen | Centre for Media and Journalism Studies, University of Groningen	Finding Narratives in News Flows: The Temporal Dimension of News Stories	000649	000491	000280	000263	000625	000353	000145	000355	000688	000352	https://digitalhumanities.org/dhq/vol/15/4/000582/000582.html
000583	2022	Elli Bleeker | Bram Buitendijk | Ronald Haentjens Dekker | Vincent Neyt | Dirk Van Hulle	Huygens Institute for Dutch History and Culture | Royal Netherlands Academy of Arts and Sciences - Humanities Cluster, Digital Infrastructure department. | Huygens Institute for Dutch History and Culture | University of Antwerp | University of Oxford	Layers of Variation: a Computational Approach to Collating Texts with Revisions	000082	000489	000430	000697	000503	000293	000069	000579	000144	000605	https://digitalhumanities.org/dhq/vol/16/1/000583/000583.html
000584	2022	Chris Diaz	Northwestern University	Minimal Computing with Progressive Web Apps	000646	000600	000593	000586	000669	000596	000668	000594	000591	000695	https://digitalhumanities.org/dhq/vol/16/2/000584/000584.html
000585	2022	Matthew Lincoln | Jennifer Isasi | Sarah Melton | François Dominic Laramée	JSTOR Labs | Pennsylvania State University | Boston College | University of Ottawa and Université de Montréal	Relocating Complexity: The Programming Historian and Multilingual Static Site Generation	000594	000174	000646	000086	000112	000611	000132	000201	000588	000167	https://digitalhumanities.org/dhq/vol/16/2/000585/000585.html
000586	2022	Tanya Clement | Ben Brumfield | Sara Brumfield	University of Texas at Austin | Brumfield Labs | Brumfield Labs	The AudiAnnotate Project: Four Case Studies in Publishing Annotations for Audio and Video	000646	000524	000254	000541	000461	000519	000401	000470	000542	000515	https://digitalhumanities.org/dhq/vol/16/2/000586/000586.html
000587	2022	Martin Paul Eve	Birkbeck College, University of London	Lessons from the Library: Extreme Minimalist Scaling at Pirate Ebook Platforms	000646	000104	000069	000553	000492	000003	000596	000102	000369	000325	https://digitalhumanities.org/dhq/vol/16/2/000587/000587.html
000588	2022	Nabeel Siddiqui	Susquehanna University	Hidden in Plain-TeX: Investigating Minimal Computing Workflows	000594	000600	000646	000589	000573	000585	000596	000586	000374	000608	https://digitalhumanities.org/dhq/vol/16/2/000588/000588.html
000589	2022	Zahra Rizvi | Rohan Chauhan | A. Sean Pue | Nishat Zaidi	Department of English, Jamia Millia Islamia | Department of Modern Indian Languages and Literary Studies, University of Delhi | Department of Linguistics, Languages and Cultures, Michigan State University | Department of English, Jamia Millia Islamia	Minimal Computing for Exploring Indian Poetics	000646	000035	000593	000471	000600	000573	000374	000594	000485	000469	https://digitalhumanities.org/dhq/vol/16/2/000589/000589.html
000590	2022	Christina Boyles | Andy Boyles Petersen	Michigan State University | Michigan State University	Power and Precarity: Lessons from the Makers by Mail Project	000646	000238	000304	000483	000086	000411	000205	000571	000592	000614	https://digitalhumanities.org/dhq/vol/16/2/000590/000590.html
000591	2022	Raffaele Viglianti | Gimena del Rio Riande | Nidia Hernández | Romina De Léon	Maryland Institute for Technology in the Humanities, University of Maryland, USA | National Council on Scientific and Technical Research, Argentina | National Council on Scientific and Technical Research, Argentina | CONICET (National Council on Scientific and Technical Research, Argentina)	Open, Equitable, and Minimal: Teaching Digital Scholarly Editing North and South	000646	000593	000600	000608	000594	000668	000596	000589	000584	000585	https://digitalhumanities.org/dhq/vol/16/2/000591/000591.html
000592	2022	Jing Chen | Mengqi Li | Wensi Lin | Yinzhou Zhao | Mengyue Zhang | Han Chen | Qiang Hu | Yongqing Xie	School of Art, Nanjing University | Shanghai Traditionow Culture Development Corp | Shanghai Museum, China | Art Institute of Nanjing University | Nanjing University | Nanjing Art Institute | N/A | Nanjing Art Institute	Simple but Beautiful: A Case Study on the ZHI Project of Traditional Craftsmanship	000411	000505	000541	000557	000663	000593	000712	000594	000398	000628	https://digitalhumanities.org/dhq/vol/16/2/000592/000592.html
000593	2022	Till Grallert	Orient-Institut Beirut	Open Arabic Periodical Editions: A Framework for Bootstrapped Scholarly Editions Outside the Global North	000589	000577	000035	000584	000682	000023	000646	000245	000424	000247	https://digitalhumanities.org/dhq/vol/16/2/000593/000593.html
000594	2022	Quinn Dombrowski	Stanford University	Minimizing Computing Maximizes Labor	000646	000600	000588	000668	000585	000596	000591	000584	000586	000640	https://digitalhumanities.org/dhq/vol/16/2/000594/000594.html
000595	2022	Kailey Fukushima | Karen Bourrier | Janice Parker	University of British Columbia | University of Calgary | Calgary Public Library	The Lives of Mistresses and Maids: Editing Victorian Correspondence with Genealogy, Prosopography, and the TEI	000424	000208	000668	000411	000244	000034	000710	000183	000711	000247	https://digitalhumanities.org/dhq/vol/16/1/000595/000595.html
000596	2022	Grant Wythoff	Princeton University	Ensuring Minimal Computing Serves Maximal Connection	000600	000646	000588	000587	000698	000594	000591	000584	000541	000463	https://digitalhumanities.org/dhq/vol/16/2/000596/000596.html
000597	2022	Maria Bonn | Harriett Green | Angela Courtney | Megan Senseney	School of Information Sciences, Univesity of Illinois Urbana Champaign | Washington University in St. Louis | Indiana University Bloomington | University of Arizona	Innovation Through Collaboration in Humanities Research	000233	000213	000198	000477	000114	000351	000441	000661	000536	000620	https://digitalhumanities.org/dhq/vol/15/4/000597/000597.html
000598	2022	Kimmo Elo	University of Turku	A Text Network Analysis of Discursive Changes in German, Austrian and Swiss New Year’s Speeches 2000-2021	000649	000720	000444	000298	000222	000683	000704	000176	000697	000568	https://digitalhumanities.org/dhq/vol/16/1/000598/000598.html
000599	2022	Nathanael Moore	University of Otago	The Brain Is Deeper Than the Sea: Sea and Spar Between, Computational Stuplimity, and Fragmentation	000707	000155	000693	000397	000146	000434	000293	000181	000430	000695	https://digitalhumanities.org/dhq/vol/16/1/000599/000599.html
000600	2022	Tiffany Chan | Jentery Sayers	University of Victoria Libraries | University of Victoria	Minimal Computing from the Labor Perspective	000646	000596	000660	000588	000669	000668	000455	000469	000666	000552	https://digitalhumanities.org/dhq/vol/16/2/000600/000600.html
000601	2022	Simon Peter Rowberry	Department of Information Studies, University College London	The Ebook Imagination	000103	000111	000192	000052	000120	000108	000473	000587	000115	000210	https://digitalhumanities.org/dhq/vol/16/1/000601/000601.html
000602	2022	Nozomu Okuda | Jeffery Kinnison | Patrick Burns | Neil Coffee | Walter Scheirer	SUNY University at Buffalo, Department of Classics | University of Notre Dame, Department of Computer Science and Engineering | University of Texas at Austin, Department of Classics | SUNY University at Buffalo, Department of Classics | University of Notre Dame, Department of Computer Science and Engineering	Tesserae Intertext Service	000237	000253	000177	000651	000412	000731	000469	000668	000031	000438	https://digitalhumanities.org/dhq/vol/16/1/000602/000602.html
000603	2022	Ciaran B. Trace	The University of Texas at Austin	Archives, Information Infrastructure, and Maintenance Work	000151	000344	000069	000536	000670	000324	000524	000422	000483	000509	https://digitalhumanities.org/dhq/vol/16/1/000603/000603.html
000604	2022	Houda Lamqaddam | Inez De Prekel | Koenraad Brosens | Katrien Verbert	University of Leuven | University of Leuven | University of Leuven | University of Leuven	Perceptual Effects of Hierarchy in Art Historical Social Networks	000376	000190	000710	000703	000414	000487	000598	000728	000296	000548	https://digitalhumanities.org/dhq/vol/16/1/000604/000604.html
000605	2022	Francesca Giovannetti | Francesca Tomasi	University of Bologna | University of Bologna	Linked data from TEI (LIFT): A Teaching Tool for TEI to Linked Data Transformation	000549	000538	000475	000328	000568	000318	000726	000026	000316	000245	https://digitalhumanities.org/dhq/vol/16/2/000605/000605.html
000606	2022	Robert Gorman	Department of Classics and Religious Studies, University of Nebraska-Lincoln	Universal Dependencies and Author Attribution of Short Texts with Syntax Alone	000723	000371	000683	000574	000673	000729	000623	000333	000539	000251	https://digitalhumanities.org/dhq/vol/16/2/000606/000606.html
000607	2022	Jennifer Edmond | Nicole Basaraba | Michelle Doran | Vicky Garnett | Courtney Helen Grile | Eliza Papaki | Erszébet Toth-Czifra	Trinity College Dublin, Ireland | Maastricht University, the Netherlands | Centre for Digital Humanities, Trinity College Dublin, Ireland | DARIAH-EU | School of Creative Arts, Trinity College Dublin, Ireland | DARIAH-EU | DARIAH-EU	Scholarly Primitives of Scholarly Meetings: A DH-Inspired Exploration of the Virtual Incunabular in the Time of COVID 19	000477	000235	000401	000687	000568	000678	000107	000484	000322	000388	https://digitalhumanities.org/dhq/vol/16/2/000607/000607.html
000608	2022	Sylvia Fernandez | Rubria Rocha de Luna | Annette M. Zapata	University of Texas in San Antonio | Texas A&M University | University of Houston	United Fronteras como tercer espacio: Modelo transfronterizo a través de las humanidades digitales poscoloniales y la computación mínima	000353	000355	000352	000502	000347	000346	000345	000142	000649	000453	https://digitalhumanities.org/dhq/vol/16/2/000608/000608.html
000609	2022	Stephanie Boddie | Amy Hillier	Baylor University, Diana R. Garland School of Social Work, the School of Education, and the George W. Truett Seminary and University of South Africa, Institute for Gender Studies | University of Pennsylvania School of Social Policy & Practice	The Making and Re-making of The Philadelphia Negro	000578	000640	000644	000208	000145	000600	000596	000291	000367	000423	https://digitalhumanities.org/dhq/vol/16/2/000609/000609.html
000610	2022	Elspeth Brown | Cait McKinney | Dan Guadagnolo | Juan Carlos Mezo Gonzalez | Sid Cunningham | Caleigh Inman | Zohar Freeman | Amal Khurram | Alisha Krishna | Mackenzie Stewart	University of Toronto | Simon Fraser University | University of Toronto | University of Toronto | York University |  | Harvard Law School |  | University of Toronto Faculty of Law | University of Toronto	Transmediation as Radical Pedagogy in Building Queer and Trans Digital Archives	000483	000634	000557	000209	000217	000404	000422	000566	000379	000641	https://digitalhumanities.org/dhq/vol/16/2/000610/000610.html
000611	2022	Eamon Schlotterback | Cailin Flannery Roles | K.J. Rawson	Northeastern University | Northeastern University | Northeastern University	Investing in Project Maintenance: Auditing the Digital Transgender Archive	000610	000424	000470	000483	000287	000557	000217	000315	000284	000209	https://digitalhumanities.org/dhq/vol/16/1/000611/000611.html
000612	2022	Hoyeol Kim	Texas A&M University	Sentiment Analysis: Limits and Progress of the Syuzhet Package and Its Lexicons	000691	000498	000692	000548	000250	000673	000687	000649	000343	000730	https://digitalhumanities.org/dhq/vol/16/2/000612/000612.html
000613	2022	Wenyi Shang | Winbin Huang	School of Information Sciences, University of Illinois, Urbana-Champaign | Department of Information Management, Peking University	Rediscussing the Political Struggle in the Light of Reform in Late 11th Century China under the View of Digital Humanities	000434	000649	000705	000003	000029	000697	000370	000340	000147	000408	https://digitalhumanities.org/dhq/vol/16/2/000613/000613.html
